{
  "eventId": "foundation-test-event-001",
  "eventType": "foundation.synthetic.checked",
  "tenantId": "tenant-test",
  "siteId": "site-test",
  "resourceType": "SYNTHETIC_RESOURCE",
  "resourceId": "resource-test-001",
  "version": 0,
  "occurredAt": "2026-09-07T00:00:00Z",
  "payload": { "synthetic": true }
}
